{
  "schema_version": "1.0",
  "artifact_kind": "pooleos_native_kernel_scheduler_preemption_readiness",
  "status_date": "2026-09-29",
  "status": "pass_single_host_two_run_qemu64_bsp_timer_and_wakeup_preemption_non_promoting",
  "contract_id": "PKSCHED2",
  "selected_move_id": "N12-SCHED-PREEMPT-001",
  "production_ready": false,
  "production_promotion_allowed": false,
  "n12_exit_gate_satisfied": false,
  "phase_status": {
    "N12": "partial",
    "N12.1": "partial",
    "N12.2": "partial",
    "N12.3": "partial",
    "N12.5": "partial",
    "N12.6": "partial",
    "N12.7": "partial"
  },
  "inputs": {
    "implementation": [
      {
        "path": "runtime/native_kernel_profile_evidence.py",
        "byte_count": 6286,
        "sha256": "E40689F34D4ACA0318E2981AA81928969FA2BEAD786380F69088AD8260E765BE"
      },
      {
        "path": "tests/test_native_memory_entry_provenance.py",
        "byte_count": 4686,
        "sha256": "35E35598C58B141DDD2E895BD0CC39CD296DFC6CB2F0DDE2BFBE88AA47DA513A"
      },
      {
        "path": "runs/native_kernel_entry_readiness.json",
        "byte_count": 31746,
        "sha256": "E90F11157F3416CE2C78650C4605ADF92BF5D7AC19A293E0C105499EF17276A5"
      },
      {
        "path": "native/Cargo.lock",
        "byte_count": 4193,
        "sha256": "29CE9938C5C60DEA5AEA244A6961BB1924D88AEC601D1E02EAAA510B0B36E390"
      },
      {
        "path": "native/boot/Cargo.toml",
        "byte_count": 1863,
        "sha256": "C9175879FB21AAE932016F9E1E4F46DD0070BF0D6A2DB32AB370AF7C4D0687F6"
      },
      {
        "path": "native/boot/src/exit.rs",
        "byte_count": 44748,
        "sha256": "C12DC15E6688669A1FB8309CD40397F8191A6D3164BCBAB4BF450EED55F40529"
      },
      {
        "path": "native/bootexit/src/lib.rs",
        "byte_count": 18272,
        "sha256": "B38A280AA2390DB005DA05FE3BC60BB507A67A1A1A6608183D9DE294EC980ECF"
      },
      {
        "path": "native/kernel/Cargo.toml",
        "byte_count": 1371,
        "sha256": "F9F3AB6D84008B0354A5B82B0F616C5652C076C15F3313F14B862ED0DB1C1C43"
      },
      {
        "path": "native/kernel/linker.ld",
        "byte_count": 2048,
        "sha256": "1D5CD169A537957B4D61A734DBC71974702A1B825F0A58A10B022F8A2D3E8AC0"
      },
      {
        "path": "native/kernel/manifest.pkm",
        "byte_count": 447,
        "sha256": "72A05420D51D580789C52038A87E1B82AFD662A1EF962403F39DE58AC573AC11"
      },
      {
        "path": "native/kernel/src/lib.rs",
        "byte_count": 65667,
        "sha256": "3B70B20BA36952222BBEDEDBE83DDAA2DD0C09D1EE43E0D0A0998FF9DE2869E3"
      },
      {
        "path": "native/kernel/src/main.rs",
        "byte_count": 538452,
        "sha256": "33D87133FB1154AC300D9270D0D2D7F0AB8E2ADF929285C0468077C55DC56FB7"
      },
      {
        "path": "native/kernel/src/arch/x86_64.rs",
        "byte_count": 162769,
        "sha256": "F39BB4327F83BC44AE4E38DDFA0F46793209F30D7CA3B7A0A44342FC1BBDC058"
      },
      {
        "path": "native/kernel/src/scheduler.rs",
        "byte_count": 50523,
        "sha256": "699D2EB712489E95D35729F72438906C97EF336A04112EFF910BB46074CAE21B"
      },
      {
        "path": "native/kernel/src/scheduler_preempt.rs",
        "byte_count": 24328,
        "sha256": "DD93A83C27F49D78CBFBB1A5DB026DAC2206099E226E2038595B72DC7A81D0E4"
      },
      {
        "path": "native/kernel/src/bin/pksched2_probe.rs",
        "byte_count": 6103,
        "sha256": "DE3C0CC2D1C3DD7AC1E26CC720D59F88575FF267DE988FB104081B9BA62A29C5"
      },
      {
        "path": "native/kmap/src/lib.rs",
        "byte_count": 61575,
        "sha256": "5CFD8D3308B429C29E1FF7143F43410E081275FFD33F71715A2B626189699CD1"
      },
      {
        "path": "runtime/native_kernel_map.py",
        "byte_count": 25583,
        "sha256": "96E3F2B3F8AB57F9BA8FA051CBB417BE3F21A9B21744FEF67535767989517265"
      },
      {
        "path": "runtime/native_kernel_scheduler_preempt.py",
        "byte_count": 26675,
        "sha256": "52824FBEA71C219454773C177687DE84081E72ACCEA613BE86F300D8493D72C9"
      },
      {
        "path": "runtime/native_kernel_scheduler.py",
        "byte_count": 29682,
        "sha256": "5FAE21F0C2A2F6B63CA458D349974A323795F85BB3579DC0170B288FB7052103"
      },
      {
        "path": "specs/native-kernel-scheduler-preemption-contract.json",
        "byte_count": 6826,
        "sha256": "4D89D9355DA8A7A9A2FA74A7D95391BD9F1F12B81E379FE0D7389CBC52AC249C"
      },
      {
        "path": "specs/native-kernel-scheduler-preemption-contract.schema.json",
        "byte_count": 4521,
        "sha256": "9213FBB9B5C8E6284B4304B957328A17D531BEB0061DFC4C014F0BC761AEF747"
      },
      {
        "path": "specs/native-kernel-scheduler-preemption-readiness.schema.json",
        "byte_count": 3973,
        "sha256": "E160D2AF1DD798C86412A864D17BC14BE22E502F2D09466C5B1966257A72DA3A"
      },
      {
        "path": "tools/qualify_native_pooleboot.py",
        "byte_count": 42224,
        "sha256": "9377738EC9F76CE255D7D563ED98DE8D5053ED1D0C1644FE833E3A58F283A7B5"
      },
      {
        "path": "tools/qualify_native_kernel_scheduler_preempt.py",
        "byte_count": 29363,
        "sha256": "75C83ADE9DBDC4725140E90FE3A55A744B54C5508302D2BDA2DE6424B37EDB96"
      },
      {
        "path": "tools/qualify_native_kernel_scheduler.py",
        "byte_count": 40099,
        "sha256": "83FBF99766B373FFFDEBAE31030432B5C2105B091024962C22F654AA4FACD9CD"
      },
      {
        "path": "tests/test_native_kernel_scheduler_preempt.py",
        "byte_count": 9831,
        "sha256": "B40684A60E88773B2FBE59AA04714187AB5CB092655A0EF7369A479062C9C8E7"
      },
      {
        "path": "tests/test_native_kernel_scheduler.py",
        "byte_count": 15927,
        "sha256": "BA1FD65F5236E59A63C124F806D96938DBB75C13479260F60B333D2CAF8E80FC"
      },
      {
        "path": "tests/fixtures/pksched2_control_probe.rs",
        "byte_count": 9025,
        "sha256": "1F0A80CF4DAB8434C0A367F6B50B26670A6B9B09F0D8043F61956E1463EEFC9D"
      },
      {
        "path": "tests/test_native_preemption_controls.py",
        "byte_count": 6235,
        "sha256": "900A8C16109C6E59F28E04FDDC8DBA2BEB6254A9F2CC4DBE0211770E0718A83B"
      },
      {
        "path": "docs/native-kernel-scheduler-preemption.md",
        "byte_count": 4823,
        "sha256": "407D7AFF34A6763D5BABB1C05829B0738C8713C69CDE3A922FF4A0E382533D82"
      }
    ]
  },
  "build": {
    "kernel_entry": {
      "schema_version": "1.0",
      "artifact_kind": "pooleos_native_kernel_entry_readiness",
      "status_date": "2026-07-16",
      "status": "pass_single_host_product_image_non_promoting",
      "contract_id": "PKENTRY1",
      "selected_move_id": "N6-KENTRY-001",
      "production_ready": false,
      "production_promotion_allowed": false,
      "n6_exit_gate_satisfied": false,
      "phase_status": {
        "N6": "partial",
        "N6.4": "partial",
        "N6.5": "partial",
        "N6.6": "partial"
      },
      "bindings": {
        "contract": {
          "path": "specs/native-kernel-entry-contract.json",
          "byte_count": 10872,
          "sha256": "A9FF7AD219385D18CCA883D2DCCAABC80C6D920106F0525E964E9F4186D8BCD6"
        },
        "contract_schema": {
          "path": "specs/native-kernel-entry-contract.schema.json",
          "byte_count": 3952,
          "sha256": "73968BBE353A34EF7927C2A370164A357547824EE912D76541621E0448376273"
        },
        "readiness_schema": {
          "path": "specs/native-kernel-entry-readiness.schema.json",
          "byte_count": 1258,
          "sha256": "AAEB429160252FE060A3330D8056DE129FA608EA1E56A1DD0B0DDF8CED67ABF4"
        },
        "pbp1_contract": {
          "path": "specs/native-boot-handoff-contract.json",
          "byte_count": 16126,
          "sha256": "89EA7517EF7D2E30C7EBEC4C28D092E3F01D95519EC6768E7B4D5C0F586B58E7"
        },
        "pkelf1_contract": {
          "path": "specs/native-elf-loader-contract.json",
          "byte_count": 5797,
          "sha256": "A0CE48E9EF992B97333D84ECB2850E221D482E2ACF11BB312B5F769DAFF992AA"
        },
        "toolchain_lock": {
          "path": "specs/native-toolchain-lock.json",
          "byte_count": 4017,
          "sha256": "79084B39BC43C0B3B96ABE93328184338470A2FFFF257C6E2305215E6B2CCA4E"
        },
        "implementation_inputs": [
          {
            "path": "native/Cargo.toml",
            "byte_count": 601,
            "sha256": "210BCDAF2778606B42C688E7BACD950FC0EEF3045081E884CF7846B9A7D78DF4"
          },
          {
            "path": "native/Cargo.lock",
            "byte_count": 4193,
            "sha256": "29CE9938C5C60DEA5AEA244A6961BB1924D88AEC601D1E02EAAA510B0B36E390"
          },
          {
            "path": "native/kernel/Cargo.toml",
            "byte_count": 1371,
            "sha256": "F9F3AB6D84008B0354A5B82B0F616C5652C076C15F3313F14B862ED0DB1C1C43"
          },
          {
            "path": "native/kernel/README.md",
            "byte_count": 3199,
            "sha256": "804016CE88E41A3FAFF8130D6E6484AFCD2AC821625DC47CEA7EEDBD3524F41B"
          },
          {
            "path": "native/kernel/arch/x86_64/README.md",
            "byte_count": 1417,
            "sha256": "E7589BC85E7A56A67AFCFA335EB292D5262FBC37D78F4720AD4C3A76EBB205EB"
          },
          {
            "path": "native/kernel/linker.ld",
            "byte_count": 2048,
            "sha256": "1D5CD169A537957B4D61A734DBC71974702A1B825F0A58A10B022F8A2D3E8AC0"
          },
          {
            "path": "native/kernel/manifest.pkm",
            "byte_count": 447,
            "sha256": "72A05420D51D580789C52038A87E1B82AFD662A1EF962403F39DE58AC573AC11"
          },
          {
            "path": "native/kernel/src/lib.rs",
            "byte_count": 65667,
            "sha256": "3B70B20BA36952222BBEDEDBE83DDAA2DD0C09D1EE43E0D0A0998FF9DE2869E3"
          },
          {
            "path": "native/kernel/src/main.rs",
            "byte_count": 538452,